URL,Version,Status,OIDs,Name,Title,Descriptino,Used
http://hl7.org/fhir/CodeSystem/medicationrequest-intent,4.0.1,draft,"2.16.840.1.113883.4.642.4.1378",medicationRequest Intent,Medication request  intent,"MedicationRequest Intent Codes","ValueSet/medicationrequest-intent"
http://hl7.org/fhir/CodeSystem/medicationrequest-status,4.0.1,draft,"2.16.840.1.113883.4.642.4.1377",medicationrequest Status,Medicationrequest  status,"MedicationRequest Status Codes","ValueSet/medicationrequest-status"
http://hl7.org/fhir/days-of-week,4.0.1,active,"2.16.840.1.113883.4.642.4.513",DaysOfWeek,DaysOfWeek,"The days of the week.","ValueSet/days-of-week"
http://hl7.org/fhir/event-timing,4.0.1,active,"2.16.840.1.113883.4.642.4.76",EventTiming,EventTiming,"Real world event relating to the schedule.","ValueSet/event-timing"
http://hl7.org/fhir/request-priority,4.0.1,draft,"2.16.840.1.113883.4.642.4.116",RequestPriority,RequestPriority,"Identifies the level of importance to be assigned to actioning the request.","ValueSet/request-priority"
http://snomed.info/sct,null,active,"2.16.840.1.113883.6.96",SNOMED_CT,SNOMED CT (all versions),"SNOMED CT is the most comprehensive and precise clinical health terminology product in the world, owned and distributed around the world by The International Health Terminology Standards Development Organisation (IHTSDO).","ValueSet/condition-code,ValueSet/performer-role,ValueSet/medication-codes,ValueSet/route-codes,ValueSet/additional-instruction-codes,ValueSet/reason-medication-not-given-codes,ValueSet/administration-method-codes,ValueSet/approach-site-codes,ValueSet/medication-as-needed-reason"
http://terminology.hl7.org/CodeSystem/dose-rate-type,0.1.0,draft,"2.16.840.1.113883.4.642.1.1069",DoseAndRateType,DoseAndRateType,"The kind of dose or rate specified.","ValueSet/dose-rate-type"
http://terminology.hl7.org/CodeSystem/med-admin-perform-function,0.1.0,draft,"2.16.840.1.113883.4.642.1.1112",MedicationAdministrationPerformerFunctionCodes,MedicationAdministration Performer Function Codes,"MedicationAdministration Performer Function Codes","ValueSet/med-admin-perform-function"
http://terminology.hl7.org/CodeSystem/medication-admin-category,4.0.1,draft,"2.16.840.1.113883.4.642.4.1111",MedicationAdministration Category Codes,Medication administration  category  codes,"MedicationAdministration Category Codes","ValueSet/medication-admin-category"
http://terminology.hl7.org/CodeSystem/medication-admin-status,4.0.1,draft,"2.16.840.1.113883.4.642.4.1311",MedicationAdministration Status Codes,Medication administration  status  codes,"MedicationAdministration Status Codes","ValueSet/medication-admin-status"
http://terminology.hl7.org/CodeSystem/medicationdispense-performer-function,0.1.0,draft,"2.16.840.1.113883.4.642.1.1319",MedicationDispensePerformerFunctionCodes,MedicationDispense Performer Function Codes,"MedicationDispense Performer Function Codes","ValueSet/medicationdispense-performer-function"
http://terminology.hl7.org/CodeSystem/medicationdispense-status,4.0.1,draft,"2.16.840.1.113883.4.642.4.1313",MedicationDispense Status Codes,Medication dispense  status  codes,"MedicationDispense Status Codes","ValueSet/medicationdispense-status"
http://terminology.hl7.org/CodeSystem/medicationrequest-category,0.1.0,draft,"2.16.840.1.113883.4.642.1.1323",MedicationRequestCategoryCodes,MedicationRequest Category Codes,"MedicationRequest Category Codes","ValueSet/medicationrequest-category"
http://terminology.hl7.org/CodeSystem/medicationrequest-course-of-therapy,0.1.0,draft,"2.16.840.1.113883.4.642.1.1327",MedicationRequestCourseOfTherapyCodes,MedicationRequest Course of Therapy Codes,"MedicationRequest Course of Therapy Codes","ValueSet/medicationrequest-course-of-therapy"
http://terminology.hl7.org/CodeSystem/medicationrequest-status-reason,0.1.0,draft,"2.16.840.1.113883.4.642.1.1325",MedicationRequestStatusReasonCodes,MedicationRequest Status Reason Codes,"MedicationRequest Status Reason Codes","ValueSet/medicationrequest-status-reason"
http://terminology.hl7.org/CodeSystem/reason-medication-given,0.1.0,draft,"2.16.840.1.113883.4.642.1.1110",ReasonMedicationGivenCodes,Reason Medication Given Codes,"This value set is provided as an example. The value set to instantiate this attribute should be drawn from a robust terminology code system that consists of or contains concepts to support the medication process.","ValueSet/reason-medication-given-codes"
http://terminology.hl7.org/CodeSystem/v3-ActCode,8.0.1,active,"2.16.840.1.113883.5.4",ActCode,ActCode,"A code specifying the particular kind of Act that the Act-instance represents within its class.    *Constraints:* The kind of Act (e.g. physical examination, serum potassium, inpatient encounter, charge financial transaction, etc.) is specified with a code from one of several, typically external, coding systems. The coding system will depend on the class of Act, such as LOINC for observations, etc.    Conceptually, the Act.code must be a specialization of the Act.classCode. This is why the structure of ActClass domain should be reflected in the superstructure of the ActCode domain and then individual codes or externally referenced vocabularies subordinated under these domains that reflect the ActClass structure.    Act.classCode and Act.code are not modifiers of each other but the Act.code concept should really imply the Act.classCode concept. For a negative example, it is not appropriate to use an Act.code ""potassium"" together with and Act.classCode for ""laboratory observation"" to somehow mean ""potassium laboratory observation"" and then use the same Act.code for ""potassium"" together with Act.classCode for ""medication"" to mean ""substitution of potassium"". This mutually modifying use of Act.code and Act.classCode is not permitted.","ValueSet/v3-ActPharmacySupplyType"
http://terminology.hl7.org/CodeSystem/v3-ActReason,2.1.0,active,"2.16.840.1.113883.5.8",ActReason,ActReason,"A set of codes specifying the motivation, cause, or rationale of an Act, when such rationale is not reasonably represented as an ActRelationship of type ""has reason"" linking to another Act.    *Examples:* Example reasons that might qualify for being coded in this field might be: ""routine requirement"", ""infectious disease reporting requirement"", ""on patient request"", ""required by law"".","ValueSet/v3-SubstanceAdminSubstitutionReason"
http://terminology.hl7.org/CodeSystem/v3-GTSAbbreviation,2.1.0,active,"2.16.840.1.113883.5.1022",GTSAbbreviation,GTSAbbreviation,"*Open Issue:* It appears that the printnames are suboptimal and should be improved for many of the existing codes.","ValueSet/timing-abbreviation"
http://terminology.hl7.org/CodeSystem/v3-TimingEvent,2.1.0,active,"2.16.840.1.113883.5.139",TimingEvent,TimingEvent,"**** MISSING DESCRIPTION ****","ValueSet/event-timing"
http://terminology.hl7.org/CodeSystem/v3-substanceAdminSubstitution,2.1.0,active,"2.16.840.1.113883.5.1070",SubstanceAdminSubstitution,Substance Admin Substitution,"Identifies what sort of change is permitted or has occurred between the therapy that was ordered and the therapy that was/will be provided.","ValueSet/v3-ActSubstanceAdminSubstitutionCode"
http://terminology.hl7.org/fhir/CodeSystem/medicationdispense-category,4.0.1,draft,"2.16.840.1.113883.4.642.4.1315",MedicationDispense Category Codes,Medication dispense  category  codes,"MedicationDispense Category Codes","ValueSet/medicationdispense-category"
http://terminology.hl7.org/fhir/CodeSystem/medicationdispense-status-reason,4.0.1,draft,"2.16.840.1.113883.4.642.4.1317",MedicationDispense Status Reason Codes,Medication dispense  status  reason  codes,"MedicationDispense Status Codes","ValueSet/medicationdispense-status-reason"
http://unitsofmeasure.org,3.0.1,active,"2.16.840.1.113883.6.8",UCUM,Unified Code for Units of Measure (UCUM),"The Unified Code for Units of Measure (UCUM) is a code system intended to include all units of measures being contemporarily used in international science, engineering, and business. The purpose is to facilitate unambiguous electronic communication of quantities together with their units. The focus is on electronic communication, as opposed to communication between humans. A typical application of The Unified Code for Units of Measure are electronic data interchange (EDI) protocols, but there is nothing that prevents it from being used in other types of machine communication.","ValueSet/units-of-time"
http://www.nlm.nih.gov/research/umls/rxnorm,3.0.1,active,"2.16.840.1.113883.6.88",RxNorm,RxNorm,"RxNorm provides normalized names for clinical drugs and links its names to many of the drug vocabularies commonly used in pharmacy management and drug interaction software, including those of First Databank, Micromedex, and Gold Standard Drug Database. By providing links between these vocabularies, RxNorm can mediate messages between systems not using the same software and vocabulary. RxNorm now includes the United States Pharmacopeia (USP) Compendial Nomenclature from the United States Pharmacopeial Convention. USP is a cumulative data set of all Active Pharmaceutical Ingredients (API).","ValueSet/medication-rxnorm-tw"
http://www.whocc.no/atc,2.0.1,active,"2.16.840.1.113883.6.73",WC,WHO ATC,"WHO ATC","ValueSet/medcation-atc-tw"
https://twcore.mohw.gov.tw/ig/twcore/CodeSystem/medication-device-fda-tw,2022-08-08,active,,TWMedicationDeviceFDA,臺灣醫療器材許可證,"臺灣醫療器材許可證，參照自[https://data.fda.gov.tw/frontsite/data/DataAction.do?method=doDetail&infoId=68](https://data.fda.gov.tw/frontsite/data/DataAction.do?method=doDetail&infoId=68)    代碼出版日期：2022-08-08；資料所屬單位：衛生福利部食品藥物管理署。    *因原始資料無代碼版本資訊，故使用其「更新日期」作為版本資訊。*","ValueSet/medication-fda-tw"
https://twcore.mohw.gov.tw/ig/twcore/CodeSystem/medication-fda-tw,2022-08-03,active,,TWMedicationFDA,臺灣藥品許可證,"臺灣藥品許可證，參照自[https://data.fda.gov.tw/frontsite/data/DataAction.do?method=doDetail&infoId=36](https://data.fda.gov.tw/frontsite/data/DataAction.do?method=doDetail&infoId=36)    代碼出版日期：2022-08-03；資料所屬單位：衛生福利部食品藥物管理署。    *因原始資料無代碼版本資訊，故使用其「更新日期」作為版本資訊。*","ValueSet/medication-fda-tw"
https://twcore.mohw.gov.tw/ig/twcore/CodeSystem/medication-frequency-tw,2022-01-28,active,,TWMedicationFrequency,臺灣藥品使用頻率,"臺灣藥品使用頻率，參照至[https://dep.mohw.gov.tw/dos/lp-2503-113-xCat-DOS_dc002.html](https://dep.mohw.gov.tw/dos/lp-2503-113-xCat-DOS_dc002.html)-[Health06_全民健保處方及治療醫令明細檔_藥局](https://www.mohw.gov.tw/dl-16099-93a2fb9d-25a4-4e80-9508-88f5b317f6f9.html)    代碼出版日期：2014-03-05；資料所屬單位：衛生福利部統計處。    *因原始資料無代碼版本資訊，故使用其「更新日期」作為版本資訊。*","ValueSet/medication-frequency-tw"
https://twcore.mohw.gov.tw/ig/twcore/CodeSystem/medication-nhi-tw,2022-07-28,active,,TWMedicationNHI,臺灣健保用藥品項,"臺灣健保用藥品項，參照自[https://www.nhi.gov.tw/Content_List.aspx?n=238507DCFE832EAE&topn=5FE8C9FEAE863B46](https://www.nhi.gov.tw/Content_List.aspx?n=238507DCFE832EAE&topn=5FE8C9FEAE863B46)    代碼出版日期：2022-08-03；資料所屬單位：衛生福利部中央健康保險署。    *因原始資料無代碼版本資訊，故使用其「更新日期」作為版本資訊。*","ValueSet/medication-nhi-tw"
https://twcore.mohw.gov.tw/ig/twcore/CodeSystem/medication-path-tw,2022-01-28,active,,TWMedicationPath,臺灣給藥途徑,"臺灣給藥途徑，參照至[https://dep.mohw.gov.tw/dos/lp-2503-113-xCat-DOS_dc002.html](https://dep.mohw.gov.tw/dos/lp-2503-113-xCat-DOS_dc002.html)-[Health06_全民健保處方及治療醫令明細檔_藥局](https://www.mohw.gov.tw/dl-16099-93a2fb9d-25a4-4e80-9508-88f5b317f6f9.html)    代碼出版日期：2014-03-05；資料所屬單位：衛生福利部統計處。    *因原始資料無代碼版本資訊，故使用其「更新日期」作為版本資訊。*","ValueSet/medication-path-tw"
urn:ietf:bcp:47,2.0.1,active,"2.16.840.1.113883.6.121",Ietf3066,Tags for the Identification of Languages,"Older value from OID registry.  Superceded; see recommendations in BCP-47.","ValueSet/languages"
